{
  "schema_version": 1,
  "gate_id": "x2_r3_missing_default_route_runtime_gate_v1",
  "status": "IMPLEMENTED_RUNTIME_SLICE",
  "track": {
    "parent_gate": "x2_r2_wrong_subnet_mask_runtime_gate_v1",
    "current_release": "X2_R3_MISSING_DEFAULT_ROUTE",
    "next_release": "X2_R4_DUPLICATE_IP",
    "phase9_status": "P9_R1_PAUSED_BY_USER"
  },
  "source_boundary": {
    "parent_commit": "f6d19e21257cd24fa38a0e7eca42b186ff9c4aec",
    "extension_policy": "APPEND_ONLY",
    "runtime_inherited": true
  },
  "source_bindings": [
    {
      "binding_id": "x2_r2_parent_gate",
      "path": "plans/expansion/X2_R2_WRONG_SUBNET_MASK_V1.json",
      "sha256": "4f0b3526d17b2baf8718792b054b07937be3dd65038af9be33e93009e6ded35d"
    },
    {
      "binding_id": "x1_feature_catalog",
      "path": "plans/expansion/X1_FEATURE_CATALOG_V1.json",
      "sha256": "3dba72e83d7e17767ab0851a24541aa7d2d8b789dcf04a5aeb726ff48e9518e4"
    },
    {
      "binding_id": "evidence_v4_schema",
      "path": "schemas/evidence_v4.schema.json",
      "sha256": "dcc61966246a03a03d060714a67b5cf14aa48f6925c262c267d07408b77f8315"
    },
    {
      "binding_id": "x2_r1_topology_context_reused",
      "path": "labs/topologies/x2_r1_addressing/topology_context_v1.json",
      "sha256": "1db9a71c4e094916745067039f4fd45f1f63671d9f080efa82c93d00f8af9923"
    },
    {
      "binding_id": "x2_r3_scenario",
      "path": "scenarios/expansion/X2_R3_MISSING_DEFAULT_ROUTE.yml",
      "sha256": "863fd06d391ec8db3d5106069c035d199fb35c0789558559bd0302584cceed93"
    },
    {
      "binding_id": "x2_r3_runtime_contract",
      "path": "src/expansion/x2_missing_default_route.py",
      "sha256": "44414985964ae238432bd84f555b2dca2f4f8ae08b1761bfea7e953da9fcd14f"
    },
    {
      "binding_id": "missing_default_route_injector_restorer",
      "path": "src/fault_injection/missing_default_route.py",
      "sha256": "d87f50162b88d57a276452cba4330d8e770fec2433fae1c9a5e8395dbcba87de"
    },
    {
      "binding_id": "default_route_state_collector",
      "path": "src/collection/default_route_state_collector.py",
      "sha256": "f5cb0cd5544e335b76da861677e480e5bfd432ca0b646893b28159c177e8fc12"
    },
    {
      "binding_id": "combined_addressing_rule_engine",
      "path": "src/rules/addressing_rule_engine_x2_r3.py",
      "sha256": "40267f02bad5a4382c5025274ca34dae6fc425d83069e5ad427eb42808292c88"
    },
    {
      "binding_id": "x2_r3_orchestrator",
      "path": "src/orchestration/x2_missing_default_route_experiment_runner.py",
      "sha256": "3c081666faeafc9b8d9580bbb350f5a85aa9f6a03de65b76d8468053f939a028"
    },
    {
      "binding_id": "x2_r3_real_e2e",
      "path": "tests/e2e/test_x2_r3_missing_default_route_containerlab.py",
      "sha256": "aece5c3a2802985dcd301b6d7e51fbba234ba6fbac265811ba623bf79c069a93"
    }
  ],
  "compatibility": {
    "phase6_evidence_v3": "UNCHANGED",
    "phase6_dataset_row_v3": "UNCHANGED",
    "accepted_results": "UNCHANGED",
    "api_v1": "UNCHANGED",
    "x2_r1_gate": "UNCHANGED_AND_VERIFIED",
    "x2_r2_gate": "UNCHANGED_AND_VERIFIED",
    "extended_api": "NOT_CREATED",
    "p9_r1": "PAUSED"
  },
  "slice": {
    "fault_code": "A2",
    "fault_type": "missing_default_route",
    "fault_category": "addressing",
    "truth_model": "single_fault",
    "rule_id": "R_X2_ADDRESSING_003",
    "scenario_path": "scenarios/expansion/X2_R3_MISSING_DEFAULT_ROUTE.yml",
    "topology_context_path": "labs/topologies/x2_r1_addressing/topology_context_v1.json",
    "signature": {
      "source_address_matches_expected": true,
      "source_prefix_matches_expected": true,
      "source_default_route_present": false,
      "duplicate_address_detected": false
    },
    "preserved_signature": {
      "fault_type": "wrong_ip_address",
      "rule_id": "R_X2_ADDRESSING_001",
      "source_address_matches_expected": false,
      "source_prefix_matches_expected": true,
      "source_default_route_present": true,
      "duplicate_address_detected": false
    },
    "excluded_confounders": [
      "wrong_ip_address",
      "wrong_subnet_mask",
      "duplicate_ip"
    ]
  },
  "collector_activation": {
    "collector_id": "addressing_state_collector",
    "collector_version": 2,
    "evidence_contract": "Evidence v4",
    "raw_artifact_hash_required": true,
    "collector_provenance_required": true,
    "active_duplicate_check_required": true,
    "duplicate_address_mac_churn_detected": "NOT_REQUESTED_UNTIL_X2_R4"
  },
  "safety": {
    "invariants": [
      "DURABLE_RECOVERY_INTENT_BEFORE_MUTATION",
      "ATOMIC_MUTATION_JOURNAL",
      "BEST_EFFORT_RESTORATION_ON_PARTIAL_FAILURE",
      "IDEMPOTENT_CONFIRMED_RESTORATION",
      "FINAL_HEALTHY_STATE_VERIFIED",
      "BASELINE_BEFORE_AND_AFTER",
      "REAL_CONTAINERLAB_LIFECYCLE",
      "CLEANUP_ZERO_CONTAINERS"
    ],
    "recovery_cli_available": true,
    "external_commands_bounded": true,
    "verified_topology_reused": true
  },
  "acceptance": {
    "real_evidence_required": true,
    "real_infrastructure_e2e_required": true,
    "unit_tests_required": true,
    "integration_tests_required": true,
    "clean_checkout_regression_required": true,
    "existing_phase6_e2e_regression_required": true,
    "x2_r1_regression_required": true,
    "dataset_row_created": false,
    "model_operation_performed": false,
    "metric_created": false,
    "frozen_artifacts_unchanged": true
  },
  "runtime_authorization": {
    "containerlab_execution": true,
    "network_mutation": true,
    "new_evidence_collection": true,
    "dataset_generation": false,
    "model_fit_or_selection": false,
    "estimator_deserialization": false,
    "method_prediction": true,
    "metric_calculation": false,
    "report_only_test_access": false,
    "multiple_fault_execution": false
  }
}
